title,content
shall not apply if the lack of work is not within the control of the,"Employer or if the Employer makes a reasonable effort to notify the Nurse 
by telephone not to report for work at least two (2) hours before the 
Nurse's scheduled time to work. 
739 The Employer shall not cancel a regular shift and then offer the canceled 
employee a partial shift of four (4) or more hours. The Employer can notify 
the Nurse that instead of him/her being canceled, a full shift is being offered 
but some of the hours can be for nursing duties ""as assigned"" at the 
Employer's discretion and for which the employee is qualified to perform. 
740 It is understood that the No Cancellation Letter of Agreement shall 
supersede the above where conflicts exist between paragraphs 739 
and/or 740 and specific provisions of the No Cancellation Letter of 
Agreement so long as such Letter of Agreement remains in effect. 
741 It shall be the responsibility of the Nurse to notify the Employer of the 
Nurse's current address and telephone number. Failure to do so shall"
"26 preclude the Employer from the notification requirements, and the payment","of the above minimum guarantee. If a Nurse is terminated and is not 
notified before the start of the next shift that the Nurse would have worked 
otherwise, the Nurse shall receive four (4) hours' pay in accordance with 
the provision of this"
.,"742 If a Nurse, other than Regular full-time is called to work on what would 
otherwise have been a regularly scheduled day off, and if the Employer 
fails to give one (1) hour's notice before the start of the required shift, the 
Nurse shall be paid for the hours of work actually performed plus one (1) 
hour but not to exceed eight (8) hours pay in any one (1) shift unless the 
Nurse works more than eight (8) hours in that shift."
O – Absence Notification,"743 Any Nurse who is unable to report to work on any scheduled shift 
shall use reasonable efforts to notify her/his supervisor of the inability to 
report at least two (2) hours prior to the start of the scheduled shift."
P – Travel Time,"744 Nurses required to travel for Employer business will be paid travel time in 
accordance with federal and state wage and hour laws. Compensable travel 
time includes travel as a driver of a vehicle, or as a passenger in a vehicle 
or public transportation. 
745 The employee’s normal “home-to-work” commute time is not considered 
hours worked and is not compensable. This includes the one-way 
commute leaving home at the beginning of the trip and the one-way 
commute returning home at the end of the trip. 
746 If a Nurse reports to a regularly assigned work site and is then required to 
travel to another site to work for the day, travel time to and from the work 
sites is considered compensable travel time and will be paid. 
747 If a Nurse is given a work assignment in another location, any travel time in 
excess of the regular “home to work” commute time is considered hours 
worked and is compensable travel time and will be paid. 
748 Compensable travel time counts as hours worked for purposes of overtime 
calculations."
Q – Mileage,"749 Nurses required to travel for Employer business will be reimbursed for 
business use of personal cars according to the Employer’s current standard 
mileage rate in effect at the time of travel. Reasonable costs for taxis or"
27 public transportation and other travel related expenses such as parking,"fees and tolls are also subject to reimbursement. 
750 The employee’s normal “home-to-work” commute mileage is not eligible 
for reimbursement. This includes the one-way commute leaving home at 
the beginning of the trip and the one-way commute returning home at the 
end of the trip. 
751 If a Nurse reports to their regularly assigned work site and is then required 
to travel to another site to work for the day, mileage to and from the work 
sites is eligible for reimbursement. 
752 If a Nurse’s work assignment is at other than their regularly assigned work 
site and they travel to that other site without reporting to their normal site 
first, then the mileage in excess of the regular “home to work” commute 
mileage is eligible for reimbursement. 
800 ARTICLE VIII – SENIORITY"
"A – Seniority, Accumulation and Application","801 Regular Nurses and Short-Hour, Temporary and Per diem Nurses shall have 
equal seniority for transfers, promotions, and layoffs based upon their 
bargaining unit seniority. 
802 Regular Nurses shall accumulate seniority based upon length of continuous 
service with the Employer under this Agreement. Effective September 1, 
2002, Short-Hour, Temporary and Per diem Nurses shall accumulate 
seniority on the basis of eighty-seven (87) hours of work equaling one (1) 
month's seniority credit, for hours worked after September 1, 2002 except 
that no Nurse shall receive more than one (1) month's seniority credit in any 
one (1) calendar month. Credit for hours worked prior to September 1, 2002 
shall be on the basis of one hundred forty five (145) hours work equaling 
one (1) month’s seniority credit. When a Nurse changes status, the following 
adjustments shall apply with respect to seniority accumulation: 
Effective September 1, 2002, a Regular Nurse whose status is 
changed to Short-Hour, Temporary and Per diem shall have 
seniority earned as a Regular Nurse credited to Short-Hour, 
Temporary and Per diem status on the basis of one (1) month 
equaling eighty-seven (87) hours for all hours worked after 
September 1, 2002. Seniority credit for hours worked prior to 
September 1, 2002 shall be credited on the basis of (1) month 
equaling one hundred forty five (145) hours. 
Effective September 1, 2002, a Short-Hour, Temporary and Per diem 
Nurse whose status is changed to Regular shall have her/his"
"28 seniority earned as a Short-Hour, Temporary and Per diem Nurse","credited to Regular status on the basis of eighty-seven (87) hours 
worked after September 1, 2002 equaling one (1) month's service. 
No Nurse shall accumulate more than one (1) month's service in 
any one (1) calendar month. Seniority credit for hours worked prior 
to September 1, 2002 shall be credited on the basis of one (1) 
month equaling one hundred forty five (145) hours. 
803 Implementation of the new seniority system shall occur on June 1, 1978, 
retroactive to January 1, 1978, subject to the following provisions: 
All Regular Nurses on the payroll as of January 1, 1978, shall receive 
prior seniority credit as a Regular Nurse back to the date of hire. 
All Short-Hour, Temporary and Per diem Nurses on the payroll 
as of January 1, 1978, shall receive prior seniority credit as a Short-
Hour, Temporary and Per diem Nurse at the rate of eighty (80) 
hours seniority credit for every calendar month back to the date of 
hire. 
804 Effective September 1, 2002, such hours of seniority credit shall then be 
added to the number of hours of seniority credit accumulated after January 
1, 1978 pursuant to paragraph 802. The total number of hours shall then be 
divided by one hundred forty five (145) for all hours worked before 
September 1, 2002 in order to determine Registered Nurses' total months 
of seniority credit for all hours worked before September 1, 2002. For 
hours worked after September 1, 2002, the total number of hours to 
determine seniority credit shall be divided by eighty seven (87) to 
determine the total months of seniority credit accumulated after 
September 1, 2002. 
805 Bargaining unit seniority as defined above shall apply within the department, 
facility and bargaining unit respectively for all Nurses as follows: 
Department 
806 A department is defined as a unit such as Pediatrics, OB, ICU, ER, 
Dermatology, OR, etc. Each entity shall establish the department 
applicable to its particular operations. A clinic which has been identified by 
the Employer as a Functional Unit shall be considered a single department. 
Facility 
807 A facility is defined as a medical center and its associated Medical Office 
Buildings and satellite clinics, such as Oakland, Richmond, Hayward, etc., 
or a Call Center."
29 Bargaining Unit,808 The bargaining unit is defined as all Nurses covered by this Agreement.
B – Availability For Extra Shifts,"809 Registered Nurses who wish to work additional shifts beyond their regular 
schedules may express their availability in accordance with each facility’s 
Availability Policy. Availability for the purposes of this document means 
that any Nurse expressing availability for any shifts agrees to work if 
scheduled. Such availability for a scheduled shift shall remain in place 
unless modified or withdrawn by the Nurse pursuant to facility policy prior 
to seventy-two (72) hours before the commencement of the shift. 
810 Nurses who have made themselves available shall be selected to work extra 
shifts based upon scheduling needs and seniority in accordance with 
the following priority: 
First to employees available on a straight time basis in the following order: 
Employees in the same department and shift; 
Employees in the same department, other shifts;  
Float Department employees, same shift; 
Float Department employees, other shifts;  
Other employees from the facility; 
Employees from another Kaiser facility. 
Second to employees available to work on an overtime basis by seniority 
in the same order as above, but in the following sequence according to the 
least amount of overtime pay: 
Employees available to work at time and one-half (including daily or 
weekly overtime, 6th consecutive day in a payroll week, eighth 
(or more) consecutive day). 
Employees available to work at double time (including double shifts, 
hours in excess of 12, seventh day in a work week). 
Prior to offering third weekend penalty pay, the facility may offer extra 
shifts to Nurses who have not indicated formal availability. Registry 
and travelers may be offered extra shifts only after the above 
process has been followed and has not been successful in assigning 
the extra work. 
Finally to employees available to work for third weekend penalty pay, by 
seniority in the same order as above."
,"810, the Employer may give first priority to employees who will not work 
overtime, as defined in"
"708 and 709 of the CBA, at any time during","the workweek that includes the extra shift.  Employees who would work 
overtime at any time during the workweek that includes the extra shift may 
be given second priority.  The rules set forth in"
810 will determine,"the priority order as between employees within either of these groups. 
(Appendix P -  Extra Shifts 2014-2017 Collective Bargaining Agreement).     
812 Nurses who have made themselves available shall be able to exercise 
their seniority up to 72 hours prior to the beginning of the shift. As of 
seventy-two (72) hours prior to the shift, Nurses selected in accordance with 
the above priority shall be confirmed to work. Previously scheduled but 
less senior Nurses who are displaced under this provision shall be so 
notified by the Employer immediately upon displacement. Nurses 
confirmed to work at seventy-two (72) hours shall be expected to report to 
work as scheduled. 
813 A Nurse who removes his or her availability at time of confirmation shall be 
relisted for availability purposes in the least senior position, unless such 
Nurse resubmits availability for the desired shift to the staffing office in 
accordance with facility policy. 
814 Nurses who are not confirmed at seventy-two (72) hours shall remain 
on the availability list until the shift commences, but such Nurses shall 
not have any displacement rights over junior Nurses that have been 
previously confirmed. Selection of any employees to work after the 
seventy-two (72) hour period shall continue to be as provided for in 
paragraph 810, above."
C – Breaking A Seniority Tie,"815 If two (2) Nurses have the same seniority date, the following method 
shall be implemented for breaking any seniority ties: 
First, by using the last four (4) digits of the Registered Nurse’s California 
Registered Nurse License number, with the lower number being 
considered the more senior Nurse; and, if this is not resolved, 
Second, by using the full California Registered Nurse license number, 
with the lower license number being considered the more senior Nurse."
D – Layoff and Recall,"816 A layoff, as referred to above in"
"A – Seniority, Accumulation and","Application, is defined as an involuntary change to unpaid status of more 
than fourteen (14) consecutive days. A cancellation involves any reduction"
31 of a day or less of work. A short term reduction in force involves any,"reduction of more than one but less than 14 days. 
Reduction in Force of Less than Fourteen (14) Days 
817 For short term reductions in force, scheduled hours will be reduced or 
canceled in the following order in the affected department: 
Registry personnel. 
Volunteers to reduce or cancel hours. 
Nurses with the least bargaining unit seniority (inverse seniority) 
in the following group: Per diem and Temporary, Regular and Short-
Hour working beyond regular schedule (extra hours or days) in that 
payroll week. 
Nurses with the least bargaining unit seniority (inverse seniority) 
in the following group: Regular and Short-Hour working regular 
scheduled hours. 
818 Nurses who are involuntarily reduced shall be offered work within her/his 
facility that is being performed by Registered Nurse registry personnel 
provided such Nurse is qualified to perform the work. 
819 Nurses who volunteer or are involuntarily reduced shall have the option (if 
applicable) to take earned vacation, a holiday, compensatory time, or unpaid 
leave of absence. 
Layoffs 
820  In the event of a layoff, on the request of the Association or the Employer, 
the Parties shall investigate the feasibility of a work-share arrangement 
among Nurses, and may, by mutual agreement, institute such a work-share 
arrangement. If no agreement is reached on a work-share arrangement, 
Nurses who are laid off shall have seniority among themselves and shall 
be given first preference for position vacancies in the Northern California 
Region provided that the Nurse is qualified to fill the vacancy. [See 
paragraph 4027 for effects of disciplinary actions on transfer requests.] 
821 In the event the Employer implements a layoff of sixty (60) days or 
more, the Employer will notify and meet with the Association at their 
request prior to layoff to discuss the layoff and retention procedures 
specific to that situation.  In any such layoff, the Employer will retain 
Patient Care Coordinator Case Managers based on their department 
seniority within the facility.  Work will be reassigned by the Employer 
provided the Patient Care Coordinator Case Manager is qualified to"
"32 perform such work.  In the event of a layoff, The Employer is under no","obligation to reassign,  orient, train, or  cross-train a Staff  Nurse  I-IV, 
Home Health Nurse I-II, or Nurse Practitioner I-III to work as a Patient 
Care Coordinator Case Manager.
822 Laid off Nurses shall retain seniority and preference rights for: Twelve (12) 
months; or 
Until the Nurse has been placed in a permanent position of like 
status, classification and pay held prior to layoffs, or has opted to 
accept a position in a different status, classification, and/or pay; or 
Until the Nurse has refused recall to a position of like status, 
classification and pay held prior to layoff within the facility, whichever 
occurs first. 
While on layoff, the Nurse may elect per diem status without 
affecting her/his preference rights under this provision. 
Preference Rights 
823 Whenever a Nurse is laid off, prior to the actual last day of work of such 
Nurse, the Employer will request that the Nurse submit a transfer request 
form for each facility (hospital or medical office) at which the Nurse would 
like to be considered for potential vacancies, should they become 
available after the Nurse is laid off. Laid off nurses shall be assisted in 
accessing Kaiser Permanente’s available internally posted 
position(s), upon request, for a period of twelve (12) months after the 
layoff date. 
824 Nurses shall be recalled in the inverse order of layoff."
E – Extended Layoffs,"825 In the event the Employer implements a layoff of sixty (60) days or 
more, the Employer will notify and meet with the Association to discuss 
layoff and retention procedures specific to that situation. In any such layoff 
the Employer will retain Nurses based on their bargaining unit seniority 
within their assigned entity (hospital or clinic) and reassign the work 
provided the Nurse is qualified to perform such work. 
826 It is agreed that the reassignment selection process in the affected units 
will be based on seniority and the ability to be oriented, cross-trained, or 
trained within a reasonable period (see below) to perform available work 
as referenced above."
"33 827 It is agreed that the definitions for orientation, cross-training, and training","are as follows: 
Orientation consists of up to five (5) days, depending on the 
competency of the individual, and the needs of the patient and 
unit. This generally represents moving between similar units. 
Cross-training consists of up to eighty (80) hours and generally 
represents cross-training to a more specialized (similar) unit, or for 
Nurses with previous experience in a more specialized area. 
Training consists of more than eighty (80) hours and no more than 
three months. The Parties agree that Nurses who require training 
shall only be reassigned to such units contingent on an expectation 
of success in such training within three (3) months or less. Nurses 
who require more than three (3) months training at the time of 
reassignment shall not be reassigned to such departments or units. 
Departments or units that meet these criteria include, but are not 
limited to, Critical Care, Labor and Delivery, Emergency, Oncology, 
GI Procedures, Surgical Services and Mental Health. The Parties 
shall determine if additional departments or units at a hospital or 
outpatient clinic where a layoff is to occur meet these criteria and 
should be subject to the same restrictions. The Employer may, but is 
not required to, provide additional training in order to enable a Nurse 
to be eligible for an assignment that requires training under this 
paragraph. 
828 The Parties agree that the Employer will provide an evaluation forty-five (45) 
days after completion of orientation, cross training, and/or training to 
assess the employee's competence. 
The Employer agrees to provide regular performance feedback to the Nurse 
during the training period. 
If during the training period management determines that a Nurse is not 
successfully progressing through the training period, and concludes that 
additional training will not be successful, or at the conclusion of the 
training period the Employer determines that a Nurse failed to meet 
the objectives of the training/orientation program required for the new 
position, the Nurse will be assessed for competence to perform the job. The 
Employer has the right to lay off such Nurse without regard to bargaining 
unit seniority, provided there are no open positions for which the RN is 
qualified. The Employer will meet with the Union to identify all reasonable 
alternative placement options and make a good faith effort to agree on 
such placement prior to laying off the Nurse. Nothing herein shall 
preclude the Association from filing a grievance on behalf of the affected 
Nurse."
34 829 Recall of an employee who is laid off shall be in accordance with Article,"VIII, paragraphs 820-824."
F – Non-Registered Nurse Experience,"830 Newly classified Registered Nurses who have had previous experience 
with the Employer in a Kaiser Permanente facility covered by this 
Collective Bargaining Agreement in a nursing classification shall be given 
prorated seniority credit on the basis of one (1) year's seniority for every 
three (3) years of continuous service with the Employer in such a nursing 
classification. The nursing classifications that are eligible for credit are: 
LVN, CNA, Nursing Assistant (or Care Partner), certified personnel such 
as Respiratory Techs and X-Ray Techs, and other classifications or 
individuals whose experience is relevant and mutually agreed upon by the 
Parties. 
900 ARTICLE IX – POSITION POSTING AND FILLING OF VACANCIES"
A – Posting,"901 Registered Nurse positions under this Agreement which are permanently 
vacated or newly created in a given entity shall be posted on the bulletin 
board for one (1) day within the department in which they occur. Nurses 
within the department shall be given preference in filling such position on 
a seniority basis. If the position is not filled from within the department in 
accordance with the foregoing, the vacancy shall be posted on bulletin 
boards for five (5) days in the facility where it occurs, and shall be 
simultaneously posted on Kaiser Permanente’s internet job site. The 
Employer’s obligation to post on bulletin boards for 5 days in the 
facility expires at the of the 2017-2022 contract.  
902 Written requests for a change in shift or scheduled hours within the same 
classification and department shall be considered an automatic/ open  bid for 
shift change or scheduled hours for ninety (90) days following submission 
of such request to her or his manager. Automatic/ open  bids under this 
provision shall only be applicable to one (1) day department postings 
within the RN/NP’s department, and shall be subject to the limits on 
applications set forth in paragraph 913. 
903 Applicants who successfully bid on a posted position shall be transferred 
to the new position as soon as reasonably possible subject to operational 
requirements. Under no circumstances shall the transfer be delayed more 
than one (1) month from the time the position is awarded unless by mutual 
agreement between the Parties. 
904 For the purposes of this"
"only, a Short-Hour, Temporary and Per",diem Nurse shall fulfill the requirement of six (6) months in a department
35 upon completion of five hundred twenty (520) hours of work in that,"department. 
905 All Short-Hour, Temporary, Per diem Nurses, or Nurses assigned to a float 
pool department position who begin work in a given department shall 
become eligible for bidding on vacancies within that Department after 
completion of five hundred twenty (520) hours therein. The Nurses 
referenced above who fulfill the five hundred twenty (520) hour 
requirement within one department shall retain seniority rights in that 
department as well as the float department. Nurses shall forfeit those 
seniority rights in any such department where no work is performed 
within a calendar year. The intention of this"
is solely to establish,"twenty-four (24) hour bidding rights for all Nurses whose exclusive 
assignment is to float. 
906 If the Employer determines that specialty training positions (including 
but not limited to OR, ED, L&D, ICU, WOC, etc.) are required due to 
vacancies and/or lack of fully-qualified RNs, such positions will be posted 
as Staff Nurse positions in accordance with paragraph 901 and filled in 
accordance with paragraphs 908 and 909. Such postings will include the 
permanent shift assignment and schedule for the position, and the actual 
training schedule which may be different. RNs who already meet the 
standard minimum requirements for the positions shall not have to 
complete the training course. Successful applicants for the training 
positions shall be transferred in time for commencement of the training 
program."
B – Special Notification to Absent Nurses,"907 For Nurses on vacation or leave of absence who have requested such in 
writing, notices of vacancies shall be sent to an address indicated by the 
Nurse. A Nurse who is on leave of absence in excess of thirty (30) days and 
is granted the position must be available to return to work within at least 
fourteen (14) days from the date of the posting of the position if required by 
the facility."
C – Preference in Filling Vacancies,"908 Nurses employed by the Employer may apply for such permanent 
vacancy or newly created position and shall be given preference in filling 
such vacancy on a seniority basis provided the Nurse is qualified to fill the 
vacant position. A Nurse may determine the status of her/his transfer 
request or outcome of a posted position by logging onto the Kaiser 
Permanente internet job site or contacting the local Human Resources 
Staffing/Recruitment Office. [See paragraph 4027 for effects of disciplinary 
actions on transfer requests.]"
