title,content
2 104 Disputes concerning this provision may be referred directly to an expedited,"arbitration.  The sole issue in any such arbitration shall be whether the 
Employer violated the commitments set forth in paragraph 103 of the 
Agreement. If the Employer is found to have violated paragraph 103, the 
sole remedies shall be restoration of the status quo ante , and a make-
whole remedy for the affected bargaining unit nurses. The arbitrator shall 
issue a written decision within fourteen (14) days after conclusion of the 
hearing. No extensions shall be granted without mutual agreement. 
200 ARTICLE II – COVERAGE 
201 The Nurses covered by this Agreement are those Nurses who can legally 
practice as graduate Registered Nurses who are employed by the 
Employer to perform nursing service, including Interim Permittees, but 
excluding Nurses engaged in research activities or Nurses holding 
administrative or executive positions who have the authority to hire, 
discipline or discharge Nurses or other personnel, or to effectively 
recommend such action. 
300 ARTICLE III – ASSOCIATION SECURITY"
A – Required Membership,"301 It shall be a condition of employment that all Nurses of the Employer 
covered by this Agreement shall remain members of the Association in 
good standing and those who are not members on the execution date of 
this Agreement become and remain members in good standing of the 
Association. It shall also be a condition of employment that all employees 
covered by this Agreement and hired on or after its execution date shall, 
within thirty-one (31) days following the beginning of such employment, 
become and remain members in good standing in the Association. If a 
Nurse has a sincerely held religious belief that prohibits him or her from 
joining and maintaining membership in a union, s/he may elect to pay 
the amount equivalent to initiation fees and monthly dues to charity in lieu 
of payments to CNA by advising CNA in writing of his/her religious 
objection and making monthly donations in an amount equivalent to CNA 
dues to one or more of the following charities: American Heart Association, 
American Cancer Society, AIDS Foundation, Planned Parenthood, Doctors 
Without Borders, RN Response Network (RNRN), The Multiple Sclerosis 
Society, World Wildlife Fund, The Nature Conservancy and Heifer International 
Foundation. The Nurse must show proof to CNA of having made the 
contributions to charity in the amount of membership dues on a monthly 
basis.  If a Nurse who has elected to make charitable contributions in lieu 
of paying membership dues requests to CNA to use the grievance-
arbitration procedure on his/her behalf, CNA may charge the employee for 
the reasonable cost of using the procedure."
B – New Employee Notices,"302 At the time of employment, a copy of this Agreement shall be given 
by the Employer to each Nurse and specific attention shall be called to 
the obligation of this provision. The Employer shall also give to each 
Nurse at the time of employment the current Association form authorizing 
voluntary payroll deduction of monthly dues. Within thirty (30) days after 
the execution date of this Agreement, the Employer will provide the 
Association with a master list of all employed Nurses who are subject to 
the provisions of this Agreement giving the electronic data agreed to 
between the Parties. On or before the tenth (10th) of each month 
subsequent to the establishment of the master list, the Employer will forward 
to the Association the electronic data agreed to between the Parties."
C – New Employee Orientation,"303 The Union and Employer shall coordinate times for Association 
Representatives/Nurse Representatives (or designees) to meet with 
new bargaining unit members for one (1) hour during the New Employee 
Orientation period. The Employer will provide the Association 
Representative with New Employee Orientation schedules, subject to 
change, on an annual basis, and updates as they occur, including dates, 
times and locations of the sessions. Such time will be scheduled within the 
new employee orientation agenda. Local management will work with the 
Association to provide an area that is appropriate for the Association to 
meet with the new bargaining unit members. 
304 It is further understood that, should the Association designate a Nurse 
Representative to meet with new employees, the Nurse Representative’s 
time will be paid and the Nurse Representative will be released from 
work for the time needed to meet with employees, provided that the 
Nurse Representative gives his/her supervisor sufficient advance notice 
to enable the Employer to plan for operational and patient care needs. 
305 The Employer will make its best efforts to provide the Association with a list 
of the expected RN/NP participants in orientation at least 48 hours prior to 
the session."
D – Maintenance of Membership,"306 Employees who are required hereunder to maintain membership and fail to 
do so and employees who are required hereunder to join the Association 
and fail to do so, shall upon notice of such action in writing from the 
Association to the Employer and after counseling by the facility, be given 
fourteen (14) days' notice of termination or shall be allowed to resign with 
proper notice to the facility."
E – Payroll Deduction of Association Dues,"307 Written Assignment 
The Employer will deduct Association membership dues from the salary 
of each Nurse who voluntarily agrees to such deduction and who submits 
an appropriate written authorization to the Employer, setting forth standard 
amounts and times of deduction. Once signed, the authorization cannot be 
canceled for a period of one year from the date appearing on such written 
assignment or within a fifteen (15) day period prior to the termination date 
of the current Labor Agreement between the Employer and the 
Association, whichever occurs sooner. 
Remittance 
308 Deductions shall be made bi-weekly and remitted to the California Nurses 
Association."
F – Voluntary Political Education and Action Fund,"309 The Employer agrees to administer a voluntary check-off of employee 
contributions to the Union's political education and action fund. The 
program shall include the following provisions: 
1. Contributions to the political education and action fund are voluntary 
for employees. 
2. The Union is responsible for obtaining check-off authorization from 
each employee who wishes to have a voluntary payroll deduction. 
3. The Union will reimburse Kaiser Permanente for the costs of 
administering the payroll deduction. 
310 The parties agree that the program will be implemented during the first six 
months after ratification of the Agreement based on the Employer's systems 
capabilities."
G – Indemnification,"311 The Association shall indemnify the Employer and hold it harmless against 
any and all suits, claims, demands and liabilities that shall arise out of or by 
reason of any action that shall be taken by the Employer for the purpose of 
complying with the foregoing section of this Article."
H – No Discrimination,"312 No employee or applicant for employment covered by this Agreement 
shall be discriminated against because of membership in the Association 
or activities on behalf of the Association, and the Association agrees that 
employees covered hereby shall be admitted to membership without 
discrimination. Neither the Employer nor the Association shall discriminate 
for or against any employee or applicant for employment covered by this 
Agreement, nor for purposes of hiring, wage rates, training, upgrading, 
promotion, transfer, layoff, recall, classification, or discipline on account of 
race, color, religion, national origin, age, sex, or political affiliation. It is the 
continuing policy of the Employer and the Association that the provisions of 
this agreement shall be applied to all employees without regard to race, 
color, religious creed, national origin, age, sex, sexual orientation, political 
affiliation, marital status, handicap, medical condition, disabled veteran, and 
veterans of the Vietnam era as defined by Federal and State laws."
I – Association Assistance,"313 In the application and administration of this Agreement, the Employer shall, 
at all times, have the right to call upon the Association for assistance in 
joint interpretation or discussion of any problem which affects a Nurse or 
a group of Nurses. The Association shall honor such requests promptly and 
seek, in conjunction with the Employer, a harmonious solution to such 
problems as may arise. 
314 The Employer intends to meet its obligations under the National Labor 
Relations Act (NLRA) regarding changes in policies or procedures 
affecting terms and conditions of employment of Registered Nurses covered 
by this Agreement. When required, notice will be provided to the CNA 
Kaiser Division Director for policies and procedures that are applicable on 
a regional basis, and to the assigned CNA Labor Representative for those 
policies and procedures that are facility specific."
J – Association Visiting Rights,"315 Duly authorized representatives of the Association shall be permitted at all 
reasonable times to enter the facilities operated by the Employer for the 
purposes of transacting Association business and observing conditions 
under which Nurses are employed; provided, however, that the 
Association's representatives shall upon arrival at the facility notify the 
Administrator or her/his designee of the intent to transact Association 
business. The Association representative shall advise the Administrator as 
to which department or areas s/he wishes to visit, and confine her/his visits 
to such departments or areas as agreed upon."
6 316 Transaction of any business shall be conducted in an appropriate location,"subject to general Hospital and Clinic rules applicable to non-employees 
and shall not interfere with the work of employees."
K – No Conflicting Agreements,"317 No employee shall be required nor permitted to make a written or verbal 
agreement with the Employer which may conflict with the terms of this 
collective bargaining agreement."
L – Nurse Representative,"318 The California Nurses Association may appoint Nurse Representatives who 
shall be non-probationary employees of the facility and shall notify the facility 
in writing of such appointments. 
319 The function of the Nurse Representative shall be to handle grievances 
and to ascertain that the terms and conditions of the contract are observed. 
In handling grievances, the Nurse Representative shall only deal with 
representatives of the facility designated to handle grievances. The facility's 
designated representatives are only required to meet with one (1) Nurse 
Representative on any grievance. 
320 The activities of the Nurse Representatives under this Article shall not 
unduly interfere with the Nurse Representative's work or the work of any 
other employee. 
400 ARTICLE IV – BULLETIN BOARDS 
401 To ensure reasonable access to information, each facility will provide 
bulletin boards in central and convenient location(s) using a guideline of a 
minimum of one (1) bulletin board for each one hundred (100) Nurses or 
portion thereof on the staff. When reasonable access cannot be achieved 
at a specific facility within the above guideline, a representative from the 
Association and the Human Relations Consultant of the facility will meet 
to determine a mutually agreeable solution. Requests for additional 
bulletin board access shall not be unreasonably denied. A designated 
Association representative shall be responsible for posting material 
submitted by the Association, a copy of which shall be furnished to the 
Employer before posting. The Association agrees that no controversial 
material shall be posted. It is further agreed that the Employer shall post 
position vacancies as provided in Article IX of the contract on such bulletin 
boards."
A – Probationary Nurses,"501 Regular Registered Nurses may be discharged without recourse to the 
grievance procedure within the first ninety (90) days of employment. Short-
Hour, Temporary and Per diem Registered Nurses may be discharged 
without recourse to the grievance procedure until such Nurse has been 
employed for six (6) months or worked three hundred (300) hours, 
whichever comes first."
B – Regular Nurses,"502 A Regular Nurse is defined as a Nurse who is regularly employed to 
work a predetermined work schedule of twenty (20) or more hours per 
week. Any Nurse designated as a Regular Nurse shall accumulate and 
receive all fringe benefits as provided in this Agreement when the Nurse 
becomes, and so long as the Nurse remain s, a Regular Nurse. (Regular 
part-time Nurses shall receive prorated benefits pursuant to paragraph 
2401.)"
"C – Short-Hour, Temporary and Per diem Nurses","503 A Short-Hour Nurse is one who is regularly scheduled to work on a 
predetermined work schedule of less than twenty (20) hours per week. 
504 A Per diem Nurse is one who is employed to work on an intermittent basis. 
A Per diem Nurse may be scheduled in advance in order to cover pre-
scheduled vacation or education leave time for Regular Nurses.  For pre-
scheduled vacation and education leave shifts, Per Diems shall not be 
cancelled or displaced and shall not be able to exercise the 72 hour 
cancelation provision (para 809, 812).  All other shifts shall otherwise 
be scheduled in accordance with Article VIII,"
B – Availability,"for Extra Shifts . Per-Diem employees must make themselves available 
to work at least four (4) shifts in any one Master Schedule which consists of 
two (2) consecutive payroll periods, two shifts of which, where required, 
must be on the weekend (pursuant to Article VII,"
"G, paragraph","725 of the Agreement). 
505 A Temporary Nurse is one who is hired as an interim replacement, or one 
who is hired for temporary work on a predetermined work schedule which 
does not extend beyond three (3) calendar months."
D – Staff Nurse Categories,"506 Following are brief descriptions of RN and NP classifications. The parties 
have agreed upon complete job descriptions for Staff Nurse I-IV in the 
inpatient setting and in the Emergency Departments, for inpatient Charge"
"8 Nurse, and for Home Health Nurse I-III; the parties are continuing to review","job descriptions for RNs and NPs in outpatient settings. 
507 Staff Nurse I-IV 
Staff Nurse I 
A Nurse employed by the facility who has less than six (6) months of 
recent hospital, clinic or similar nursing experience. 
Staff Nurse II 
A Nurse employed by the facility who has at least six (6) months of recent 
hospital, clinic or similar nursing experience. 
Staff Nurse III 
A Nurse employed by the facility who has at least 5 years of clinical 
experience as a Registered Nurse and who meets the requirements as 
describe in Article XVI. 
Staff Nurse IV 
A Nurse employed by the facility who has at least 8 years of clinical 
experience as a Registered Nurse and who meets the requirements as 
described in Article XVI. 
508 Home Health Nurse I-III 
A Registered Nurse assigned responsibility for delivery of health 
services to patients in a home setting. Typically, such nursing care, as 
directed by the physician, will include administration of treatment and 
medication, assessment of patient's condition, teaching and supervision of 
patient and family in general and specific procedures essential to nursing 
plan for patient, coordinating the patient's needs with Kaiser and 
community resources and reporting the patient's progress to the physician. 
Home Health Nurse I 
A Registered Nurse who has a minimum of eighteen (18) months of 
applicable Registered Nurse experience within the last five (5) years, as 
determined by the Employer. 
Home Health Nurse II 
Registered Nurse who has a minimum of two (2) years of applicable 
Registered Nurse experience within the last five (5) years, as determined 
by the Employer, of which at least six (6) months must be home health"
9 experience within a hospital- based or community-based home health,"agency. 
Home Health Nurse III 
A Registered Nurse who has a minimum of five (5) years of applicable 
Registered Nurse experience within the last five (5) years, as determined 
by the Employer of which at least three (3) years must be as a Home Health 
Nurse with the Employer, or two (2) years as a Home Health Nurse with the 
Employer and one (1) year home health experience within a Medicare 
certified hospital-based or community-based home health agency and who 
meets the requirements as described in Article XVI. 
509 Nurse Practitioner I-III 
Nurse Practitioners will be recognized in a three step clinical ladder. 
Nurse Practitioner I 
A new graduate Nurse Practitioner or newly employed Nurse Practitioner 
with less than twelve (12) months experience as a Nurse Practitioner. NP I 
shall participate in a Nurse Practitioner mentoring program within the first 
six (6) months of KP employment. 
Nurse Practitioner II 
A Nurse Practitioner who has completed six (6) months of service as a 
NP I, or who has been newly hired into a Nurse Practitioner position and has 
at least twelve (12) months experience as a Nurse Practitioner with 
another employer. NP IIs shall be mentored in the Nurse Practitioner 
Mentoring Program. The Nurse Practitioner’s manager, the Nurse 
Practitioner and the Nurse Practitioner’s mentor shall agree on the length 
of the Nurse Practitioner’s mentoring, which shall be based upon the 
Nurse Practitioner’s competence in the clinical and technical job 
requirements. 
Nurse Practitioner III 
A Nurse Practitioner clinical expert who has met the criteria as defined in 
the Nurse Practitioner Clinical Ladder guidelines set forth in Article XVIII. 
510 Charge Nurse 
A Registered Nurse who provides professional leadership and direction 
of department personnel necessary to maintain the efficient delivery of 
effective nursing care, and is responsible for managing the care/service"
"10 given to a group of patients, which includes coordinating the activities of the","nursing unit/department. 
511 Interim Permittee 
A Nurse who has been issued an Interim Permit but is not yet a licensed 
Registered Nurse."
E – Preceptors,"512 A preceptor is a Registered Nurse designated by the Employer to perform 
that role. Qualified RNs who volunteer to be designated as preceptors will 
be selected by seniority to attend an Employer-provided preceptor-
training program. In each department  where  preceptors  are  assigned, 
the  Employer  shall  make  such assignments on a rotational basis by 
seniority from RNs who have volunteered to be preceptors. 
513 Preceptorships shall be conducted in accord with each department's 
established criteria, after review by the PPC. 
514 To be considered for assignment as preceptor, a RN must have been 
employed by the Employer for at least six (6) months, shall have at least 
two (2) years of satisfactory experience as a RN in the relevant area of 
clinical expertise, and demonstrated current competency in the department 
which the RN is assigned. If there are no qualified volunteers in a 
department, and a qualified Nurse with less than two (2) years of 
experience who meets the other criteria of this paragraph volunteers, that 
Nurse may be designated and assigned as a preceptor. 
515 Each RN designated to perform as a preceptor shall attend an Employer-
provided preceptor-training program prior to performing those duties. Each 
RN shall be paid the RN's regular hourly rate for attending the training. 
516 Each RN designated to perform as a preceptor shall attend an Employer-
provided advanced preceptor-training program after precepting two (2) 
new RN graduates or after one (1) year of experience as a preceptor. 
517 A RN who is designated as a preceptor to either a new employee or transfer 
shall receive additional compensation of $1.50 per hour above the RN's 
hourly rate for each hour that the RN is assigned to perform preceptor duties 
and responsibilities. 
518 When a RN is assigned to perform preceptor duties, the preceptor and 
preceptee shall share a single assignment and only one of the nursing pair 
will be counted in the staffing mix."
11 519 The preceptor will not be called back into the staffing mix except,"during an emergent situation in which reasonable attempts to obtain 
appropriate staff resources have failed. The RN being precepted will 
be assigned duties as determined by the preceptor, manager and the RN 
being precepted. A preceptee or trainee shall not be floated to a different 
department during the preceptorship."
F – Float Department,"520 Each Medical Center shall establish a Float Department. There shall be the 
option to create a Float Department in the outpatient clinics based on 
operational needs, with input from the RN/NP staff. 
Purpose: 
521 The Float Department will: 
Provide hospitals and outpatient clinics a deployable, flexible 
RN/NP staff based on operational needs. 
Provide flexible work environments for RNs/NPs. 
Assist in providing sufficient staff for census fluctuations, and 
vacations, education, sick, and other leave replacements. 
Principles 
522 The Float Department shall: 
Be a discrete department with benefited and non-benefited 
positions (full time, part time, short hour, per diem). 
Have posted start and finish times. 
Be above and not displacing core staffing. 
Have pre-scheduled positions, hours and times in accordance 
with the collective bargaining agreement. Per diems will be 
scheduled on an as needed basis. 
523 The Float Department RNs/NPs shall: 
Have three (3) years’ experience as a RN/NP and demonstrated 
competency in areas of assignment as determined by Performance 
Based Development System (PBDS) or unit-specific competency 
assessment tool."
12 Float to two (2) distinct nursing units and shall receive a five percent,"(5%) differential. Individual RNs/NPs may elect to voluntarily float 
to more than two (2) distinct nursing units, but shall not be required 
to do so. A regional task force comprised of nursing administration 
and RNQLs will develop guidelines to assist hospitals and 
outpatient clinics in identifying distinct nursing units within six (6) 
months of ratification of the collective bargaining agreement. 
Have an orientation individualized to each member of the Float 
Department based on current competencies and experience level. 
Be provided the opportunity to request additional shifts that shall be 
assigned by seniority within this department. 
Be provided the opportunity to request additional shifts in other 
units and shall be assigned by seniority after RNs/NPs who have 
requested additional shifts in their own units. 
Bidding rights shall be in accordance with the collective bargaining 
agreement, Article IX – Position and Filling of Vacancies,"
,"A – Posting, paragraph 901 of the agreement."
G – Voluntary Floating,"Floating Outside Home and/or Float Department Assignments 
524 In order to expand operational flexibility, the Employer proposes 
implementing the following Volunteer Floating process. Kaiser Foundation 
Hospitals will commit to the implementation of the agreed to Voluntary Float 
process. 
525 The Permanente Medical Group by facility, reserves the right to determine 
which process would best accomplish its needs, to include Float 
Department, or Voluntary Float; a combination of both. The 
implementation of the Voluntary Floating Process will void Appendix J, 
Floating of the 2006 Master Agreement. In the administration of this 
paragraph it is understood that Nurses who float shall receive 5% 
differential applied to the Nurse’s base rate. In those facilities where 
floating occurs, a voluntary floating list will be maintained. 
526 The minimum qualifications for floating within KFH or TPMG are Clinical 
Competency in a minimum of two (2) distinct nursing units."
13 Order for Floating to Designated Paired Units,"527 The order for floating to the identified paired units will be: 
• Volunteers from the Volunteer List. Selection would be by seniority 
without regard to rotation. 
• Volunteers who are not on the Volunteer List by seniority. Such 
volunteers will receive float differential for the full shift during which 
they were floated. 
• Registry/Travelers 
• Per Diem Nurses and Nurses working additional shifts, by inverse 
seniority. 
• Scheduled Nurses, working their regularly scheduled shift, by 
inverse seniority. 
528 Volunteer Process 
1. An initial voluntary sign-up list will be created for nurses interested in 
floating in the above mentioned affected units. Nurses will be notified 
two (2) weeks prior to the posting of the sign-up sheet which will be 
posted in a designated binder in each unit’s conference room. The 
list will be made available for two (2) weeks. 
2. Nurses will sign up for a twelve (12) week commitment. 
3. Nurses can add themselves to the volunteer list on an ongoing basis. 
4. Volunteers commit to a twelve (12) week period. Nurses may 
submit a notice to remove themselves from the list at any time, 
with a minimum of thirty (30) days notice, but must fulfill their twelve 
(12) week requirement. 
5. An RN may request to terminate his/her twelve (12) week obligation 
prior to fulfilling the twelve (12) weeks which will be considered on 
a case-by-case basis. The Employer and the Union will meet to 
discuss the individual requests and circumstances. For orientation 
training purpose s, a replacement RN will be identified prior to the 
termination date. Approvals will be by mutual agreement."
